{
  "schemaVersion": "1.0",
  "nodeSchemaVersions": {},
  "defaultPresetId": "preset-default",
  "validation": {
    "status": "unknown",
    "issues": []
  },
  "presets": [
    {
      "id": "preset-default",
      "name": "Moonlight Gaming",
      "isFactory": true,
      "createdAt": "2026-02-09T03:26:10.376Z",
      "updatedAt": "2026-02-09T03:26:10.376Z",
      "graph": {
        "nodes": [
          {
            "id": "launch",
            "type": "GameLaunch",
            "displayName": "Launch",
            "outputs": [
              {
                "id": "control",
                "label": "Control",
                "contract": {
                  "mediaType": "control"
                }
              }
            ],
            "attributes": {
              "launchMode": "auto",
              "workingDir": "/games"
            }
          },
          {
            "id": "runner",
            "type": "RunnerContainer",
            "displayName": "Runner",
            "inputs": [
              {
                "id": "control",
                "label": "Control",
                "contract": {
                  "mediaType": "control"
                },
                "required": true
              }
            ],
            "outputs": [
              {
                "id": "video",
                "label": "Video",
                "contract": {
                  "mediaType": "video/raw"
                }
              },
              {
                "id": "audio",
                "label": "Audio",
                "contract": {
                  "mediaType": "audio/raw"
                }
              }
            ],
            "attributes": {
              "image": "runner-base",
              "gpu": "auto"
            }
          },
          {
            "id": "comp",
            "type": "VirtualCompositor",
            "displayName": "Compositor",
            "inputs": [
              {
                "id": "video",
                "label": "Video In",
                "contract": {
                  "mediaType": "video/raw"
                }
              }
            ],
            "outputs": [
              {
                "id": "video",
                "label": "Video Out",
                "contract": {
                  "mediaType": "video/raw"
                }
              }
            ],
            "attributes": {
              "compositor": "wolf"
            }
          },
          {
            "id": "venc",
            "type": "VideoEncoder",
            "displayName": "Video Encode",
            "inputs": [
              {
                "id": "video",
                "label": "Video In",
                "contract": {
                  "mediaType": "video/raw"
                },
                "required": true
              }
            ],
            "outputs": [
              {
                "id": "video",
                "label": "Video Out",
                "contract": {
                  "mediaType": "video/encoded"
                }
              }
            ],
            "attributes": {
              "codec": "h264",
              "bitrateKbps": 30000,
              "gopSeconds": 1,
              "preset": "quality"
            }
          },
          {
            "id": "aenc",
            "type": "AudioEncoder",
            "displayName": "Audio Encode",
            "inputs": [
              {
                "id": "audio",
                "label": "Audio In",
                "contract": {
                  "mediaType": "audio/raw"
                },
                "required": true
              }
            ],
            "outputs": [
              {
                "id": "audio",
                "label": "Audio Out",
                "contract": {
                  "mediaType": "audio/encoded"
                }
              }
            ],
            "attributes": {
              "codec": "aac",
              "bitrateKbps": 128,
              "sampleRate": 48000,
              "channels": 2
            }
          },
          {
            "id": "sun",
            "type": "MoonlightSink",
            "displayName": "Moonlight",
            "inputs": [
              {
                "id": "video",
                "label": "Video In",
                "contract": {
                  "mediaType": "video/encoded"
                },
                "required": true
              },
              {
                "id": "audio",
                "label": "Audio In",
                "contract": {
                  "mediaType": "audio/encoded"
                },
                "required": true
              }
            ],
            "attributes": {
              "port": 47984,
              "protocol": "moonlight"
            }
          }
        ],
        "edges": [
          {
            "id": "edge-launch-runner",
            "from": "launch",
            "out": "control",
            "to": "runner",
            "in": "control"
          },
          {
            "id": "edge-runner-comp",
            "from": "runner",
            "out": "video",
            "to": "comp",
            "in": "video"
          },
          {
            "id": "edge-comp-venc",
            "from": "comp",
            "out": "video",
            "to": "venc",
            "in": "video"
          },
          {
            "id": "edge-runner-audio",
            "from": "runner",
            "out": "audio",
            "to": "aenc",
            "in": "audio"
          },
          {
            "id": "edge-venc-sun",
            "from": "venc",
            "out": "video",
            "to": "sun",
            "in": "video"
          },
          {
            "id": "edge-aenc-sun",
            "from": "aenc",
            "out": "audio",
            "to": "sun",
            "in": "audio"
          }
        ]
      }
    }
  ]
}
